STATION_NUMBER,REMARK_TYPE_CODE,YEAR,REMARK_EN,REMARK_FR
02BC006,2,2006,"STATION WAS RELOCATED UPSTREAM FROM PREVIOUS LOCATION. OPERATIONAL AS OF AUGUST 25, 2006 NO DATA.","STATION DEPLACEE EN AMONT DE L'EMPLACEMENT PRECEDENT. OPERATIONNELLE DEPUIS LE 25 AOUT 2006, AUCUNE DONNEE"
02BC006,2,2014,"FOR 2014, LOWER END OF CURVE NOT FULLY DEFINED; THEREFORE, DISCHARGE BELOW 0.93 CMS GRADED AS ESTIMATED AND BELOW 0.50 CMS NOT PUBLISHED DUE TO UNCERTAINTY.
MIN. INST. AND DAILY DISCHARGE NOT VALID - OCCURRED DURING UNUSABLE PERIOD.",
02BC006,2,2015,MIN INST DISCHARGE NOT VALID - OCCURRED DURING ESTIMATED PERIOD,
02BC006,2,2016,MIN INST. DISCHARGE NOT VALID - OCCURS DURING PERIOD OF ESTIMATION.,
02BC006,2,2017,MIN INST. DISCHARGE NOT VALID- OCCURS DURING A PERIOD OF LOW WATER ESTIMATION.,
02BC006,2,2018,MIN INST. DISCHARGE NOT VALID- OCCURS DURING A PERIOD OF LOW WATER ESTIMATION.,
02BC006,2,2019,MIN INST. DISCHARGE NOT VALID- OCCURS DURING A PERIOD OF LOW WATER ESTIMATION.,
02BC006,2,2020,"DUE TO MEASURES IN PLACE TO LIMIT THE SPREAD OF COVID19, REGULAR VISITS WERE REDUCED OR NOT CONDUCTED MARCH 2020 TO SEPTEMBER 2020. DISCHARGE DATA NOT PUBLISHED MAY 2, 2020 TO DECEMBER 31, 2020.
MAX AND MIN INST. AND DAILY DISCHARGES NOT VALID FOR 2020 DUE TO UNAVAILABLE DISCHARGES.",
02BC006,2,2023,MIN INST DISCHARGE NOT VALID,
