STATION_NUMBER,REMARK_TYPE_CODE,YEAR,REMARK_EN,REMARK_FR
06BD001,2,2001,MAX. INST. WATER LEVEL - RESULT OF ICE JAM,NIVEAU D'EAU MAX INST. - CAUSE PAR EMBACLE
06BD001,2,2012,THERE IS NO STAGE RECORD AFTER NOV 20TH DUE TO FROZEN VENT LINE.,IL N'EXISTE AUCUN ENREGISTREMENT DE NIVEAU APRES LE 20 NOVEMBRE EN RAISON DU GEL DE LA CONDUITE DE VENTILATION.
06BD001,2,2015,Stage record July 6 to September 21 missing due to forest fire.,
06BD001,2,2017,Maximum instantaneous values not valid due to equipment malfunction,
06BD001,2,2019,MINIMUM PEAK AND EXTREME OCCURRED UNDER ICE CONDITIONS ,
06BD001,2,2022,Minimum instantaneous and daily are not valid as they occurred under variable ice conditions and not well defined. ,
06BD001,2,2023,"MINIMUM STAGE PEAK NOT VALID- EQUIPMENT MALFUNCTION 

MINIMUM AND MAXIMUM DISCHARGE PEAK NOT VALID- OCCURRED DURING PERIOD OF ICE",
