STATION_NUMBER,REMARK_TYPE_CODE,YEAR,REMARK_EN,REMARK_FR
08LG016,2,1989,DATA REVISED DEC 5 2017,
08LG016,2,2008,"2008 MAXIMUM INSTANTANEOUS WATER LEVEL ICE AFFECTED, MAXIMUM INSTANTANEOUS Q MANUALLY COMPUTED FROM","NIVEAU D'EAU INSTANTANE MAXIMAL TOUCHE PAR LA GLACE, DEBIT INSTANTANE MAXIMAL MANUELLEMENT CALCULE A PARTIR DE"
08LG016,2,2023,"WATER LEVEL NOT AVAILABLE 2023-02-21 TO 2023-05-16.
DISCHARGE NOT AVAILABLE 2023-04-24 TO 2023-05-16.

MINIMUM INSTANTANEOUS AND DAILY WATER LEVEL NOT VALID - OCCURRED DURING PERIOD OF MISSING RECORD. 

MINIMUM INSTANTANEOUS AND DAILY DISCHARGE NOT VALID - OCCURRED DURING PERIOD OF MISSING RECORD.

MAXIMUM INSTANTANEOUS AND DAILY DISCHARGE NOT VALID - ESTIMATED DATA WITH LOW CONFIDENCE.",
