STATION_NUMBER,REMARK_TYPE_CODE,YEAR,REMARK_EN,REMARK_FR
08EB004,2,1991,1991 DISCHARGES REVISED NOV 2018,
08EB004,2,1999,MANUAL STATION ONLY.,JAUGE MANUELLE SEULEMENT.
08EB004,2,2004,"EFFECTIVE SEP 4, HOURLY WATER LEVELS FROM NEW LOGGER DATA USED TO COMPUTE DAILY MEANS.","A COMPTER DU 4 SEP, DONNEES HORAIRES DU NIVEAU DU NOUVEL ENREGISTREUR DE DONNEES UTILISEES POUR CALCULER MOYENNES QUOTIDIENNES."
08EB004,2,2007,"MAX INST JUNE 5 FROM SURVEYED HWM, TIME UNKNOWN","DEBIT INSTANTANE MAXIMAL RELEVE LE 5 JUIN A PARTIR DE L'OBSERVATION DE LA LAISSE DES HAUTES EAUX, HEURE INCONNUE"
08EB004,2,2021,"WATER LEVEL NOT AVAILABLE 2021-12-26 TO 2022-01-21.

MAXIMUM AND MINIMUM INSTANTANEOUS AND DAILY WATER LEVEL NOT VALID-EQUIPMENT MALFUNCTION 

MINIMUM INSTANTANEOUS DISCHARGE NOT VALID - ICE CONDITIONS 
",
08EB004,2,2023,MINIMUM INSTANTANEOUS DISCHARGE NOT VALID - ICE CONDITIONS,
08EB004,2,2024,MINIMUM INSTANTANEOUS DISCHARGE NOT VALID - ICE CONDITIONS,
08EB004,4,-999,1991 DISCHARGES REVISED NOV 2018,
