STATION_NUMBER,REMARK_TYPE_CODE,YEAR,REMARK_EN,REMARK_FR
08EG012,2,2007,"PERSISTENT AND UNRESOLVED INTAKE ISSUES EQUATE TO POOR DATA QUALITY FOR YEAR, HENCE 'E' USED","PROBLEMES DE PRELEVEMENT PERSISTANTS ET NON RESOLUS ASSOCIES A UNE QUALITE MEDIOCRE DES DONNEES, D'OU L'UTILISATION DE LA LETTRE < E > (ESTIMATIVES)"
08EG012,2,2023,"WATER LEVEL NOT AVAILABLE 2023-02-22 TO 2023-02-25, 2023-05-05 TO 2023-05-07.

MINIMUM INSTANTANOUS WATER LEVEL NOT VALID - MAY HAVE OCCURRED DURING PERIOD OF UNAVAILABLE DATA.

MINIMUM INSTANTANOUS DISCHARGE NOT VALID - ICE CONDITIONS.",
08EG012,2,2024,MINIMUM INSTANTANEOUS DISCHARGE NOT VALID - ICE CONDITIONS ,
