STATION_NUMBER,REMARK_TYPE_CODE,YEAR,REMARK_EN,REMARK_FR
02DD013,2,1974,MIN INST. DISCHARGE NOT VALID - OCCURS DURING PERIOD OF ESTIMATION.,
02DD013,2,2012,"NO DISCHARGE AFTER NOVEMBER 19, 2012 DUE TO CONSTRUCTION. RATING CURVE NOT VALID.",
02DD013,2,2013,"RATING CURVE STARTED JULY 22, 2013 AFTER BRIDGE CONSTRUCTION COMPLETED.",
02DD013,2,2015,MIN INST. DISCHARGE NOT VALID- OCCURS DURING PERIOD OF ESTIMATION.,
02DD013,2,2016,"MIN INST. DISCHARGE NOT VALID - 
OCCURS DURING PERIOD OF BACKWATER DUE TO ICE.",
02DD013,2,2018,MIN INST. DISCHARGE NOT VALID - OCCURS DURING PERIOD OF ESTIMATION.,
