STATION_NUMBER,REMARK_TYPE_CODE,YEAR,REMARK_EN,REMARK_FR
07JC002,2,2002,MAX. INST. DISCHARGE NOT AVAILABLE - ICE CONDITIONS,DEBIT MAX. INST. NON DISPONIBLE - DURANT PERIODE DE GLACE
07JC002,2,2003,MAX. INST. DISCHARGE NOT AVAILABLE - ICE CONDITIONS,DEBIT MAX. INST. NON DISPONIBLE - DURANT PERIODE DE GLACE
07JC002,2,2004,MAX. INST. DISCHARGE NOT AVAILABLE - ICE CONDITIONS,DEBIT MAX. INST. NON DISPONIBLE - DURANT PERIODE DE GLACE
07JC002,2,2005,MIN. DAILY DISCHARGE NOT AVAILABLE - OCCURRED OUTSIDE OPERATING PERIOD.,DEBIT MIN. QUOTIDIEN NON DISPONIBLE - EST SURVENU HORS DE PERIODE DE SERVICE.
07JC002,2,2006,MINIMUM DAILY DISCHARGE NOT AVAILABLE - OCCURRED OUTSIDE OPERATING PERIOD.,DEBIT JOURNALIER MINIMAL NON DISPONIBLE ? ATTEINT EN DEHORS DE LA PERIODE D'EXPLOITATION
07JC002,2,2008,MINIMUM INSTANTANEOUS DISCHARGE NOT VALID OCCURRED DURING ICE CONDITIONS,DEBIT INSTANTANE MINIMAL NON VALIDE ATTEINT AU COURS DE CONDITIONS GLACIELLES
07JC002,2,2009,2009 MAX INSTANTANEOUS DISCHARGE NOT VALID OCCURRED DURING ICE CONDITIONS,"DEBIT INSTANTANE MAXIMAL NON VALIDE, CAR IL A ETE ATTEINT AU COURS DE CONDITIONS GLACIELLES"
07JC002,2,2016,MAX INSTANTANEOUS DISCHARGE NOT VALID DUE TO ICE CONDITIONS,
07JC002,2,2023,MAX INSTANTANEOUS DISCHARGE NOT VALID DUE TO ICE CONDITIONS,
