STATION_NUMBER,REMARK_TYPE_CODE,YEAR,REMARK_EN,REMARK_FR
02KA015,2,2010,2010 MAXIMUM DAILY AND INSTANTANEOUS WATER LEVELS NOT VALID,NIVEAUX D'EAU INSTANTANE MAXIMAL ET JOURNALIER MAXIMAL NON VALIDES
02KA015,2,2015,MAX INST. WATER LEVEL NOT VALID. MAX AND MIN INST. DISCHARGES NOT VALID.,
02KA015,2,2016,MIN INST. WATERLEVEL AND DISCHARGE NOT VALID - MAY HAVE OCCURRED DURING PERIOD OF ESTIMATION.,
02KA015,2,2017,MIN INST. DISCHARGE NOT VALID - OCCURS DURING PERIOD OF BACKWATER ESTIMATION DUE TO ICE.,
02KA015,2,2019,MIN INST. DISCHARGE NOT VALID AS IT OCCURS DURING A PERIOD OF ESTIMATION. ,
02KA015,2,2021,"WATER LEVELS NOT AVAILABLE MAY 1 - JUNE 20, 2021 DUE TO EQUIPMENT MALFUNCTION. DISCHARGES WERE ESTIMATED",
02KA015,2,2023,"WATER LEVELS NOT AVAILABLE MAY 1 - JUNE 20, 2023 DUE TO EQUIPMENT MALFUNCTION. DISCHARGES WERE ESTIMATED",
