STATION_NUMBER,REMARK_TYPE_CODE,YEAR,REMARK_EN,REMARK_FR
05RC001,2,2008,DAILY MAX Q OCCURRED JUN 16 @ 142 CMS,DEBIT MAXIMAL QUOTIDIEN DE 142 CM ATTEINT LE 16 JUIN
05RC001,2,2013,MIN. INST. DISCHARGE NOT VALID - OCCURRED DURING BACKWATER CONDITIONS,
05RC001,2,2014,MIN. INST. DISCHARGE NOT VALID - OCCURRED DURING BACKWATER CONDITIONS,
05RC001,2,2015,"DISCHARGE DATA FOR DECEMBER 2015 WAS REVISED ON AUGUST 25, 2016. MIN INST. DISCHARGE NOT VALID - OCCURRED DURING BACKWATER ICE CONDITIONS.",
05RC001,2,2016,"PERIOD OF MISSING WATER LEVEL AND DISCHARGE JUNE 11 - SEPTEMBER 13, 2016 DUE TO SENSOR MALFUNCTION. MAX INST AND DAILY WATER LEVEL AND DISCHARGES NOT VALID - MAY OCCUR DURING MISSING PERIOD. MIN INST DISCHARGE NOT VALID - OCCURS UNDER BACKWATER DUE TO ICE.",
05RC001,2,2018,MIN INST DISCHARGE NOT VALID - OCCURS DURING PERIOD OF ESTIMATION DUE TO ICE.,
05RC001,2,2024,MINIMUM DISCHARGE PEAK NOT VALID- OCCURRED UNDER ICE ,
