STATION_NUMBER,REMARK_TYPE_CODE,YEAR,REMARK_EN,REMARK_FR
04GA002,2,1997,THE MAX. AND MIN. INST. WATER LEVELS ARE ACTUALLY THE RECORDED HOURLY EXTREME VALUES.,
04GA002,2,1998,WL ONLY FOR 1998. DISCHARGES NOT PRODUCED,
04GA002,2,2006,SIGNIFICANT PERIOD OF MISSING DATA DUE TO AN UNRELIABLE SENSOR,LONGUE PERIODE DE DONNEES MANQUANTES EN RAISON D'UN CAPTEUR PEU FIABLE
04GA002,2,2010,"2010 MISSING WL DATA IN AUG AND SEPT DUE TO LOGGER MALFUNCTION, ESTIMATED DISCHARGE FOR THE PERIOD.","DONNEES MANQUANTES SUR LES NIVEAUX D'EAU EN AOUT ET EN SEPTEMBRE EN RAISON D'UNE DEFAILLANCE DE L'ENREGISTREUR, DEBIT ESTIME POUR LA PERIODE CONNEXE"
04GA002,7,-999,NFR DATA (1983) CONTRIBUTED BY WATER QUALITY BRANCH.,DONNEES NFR (1983) FOURNIES PAR DIRECTION DE LA QUALITE DES EAUX.
