STATION_NUMBER,REMARK_TYPE_CODE,YEAR,REMARK_EN,REMARK_FR
02AB008,2,2006,SIGNIFICANT BEAVER ACTIVITY FROM JULY 1 TO NOV 10 'E',IMPORTANTE ACTIVITE DE CASTORS DU 1er JUILLET AU 10 NOVEMBRE (ESTIMATION)
02AB008,2,2014,MIN. INST. DISCHARGE NOT VALID - OCCURRED DURING BACKWATER CONDITIONS.,
02AB008,2,2015,MIN INST. DISCHARGE NOT VALID - OCCURRED UNDER ICE CONDITIONS.,
02AB008,2,2018,MAX INST. DISCHARGE NOT VALID - OCCURRED UNDER ICE CONDITIONS.,
02AB008,2,2019,"WATER LEVELS NOT AVAILABLE JULY 25 TO OCTOBER 23, 2019 AND DISCHARGES ESTIMATED. MIN INST AND DAILY WATER LEVELS NOT VALID - OCCUR DURING PERIOD OF MISSING WATER LEVELS. MAX AND MIN INST DISCHARGE NOT VALID - OCCUR DURING PERIOD OF ESTIMATIONS.",
02AB008,2,2020,PERIODS OF WATER LEVELS NOT AVAILABLE JUNE THROUGH SEPTEMBER. DISCHARGES ESTIMATED MAY THROUGH PERIODS OF SEPTEMBER DUE TO ENVIRONMENTAL CONDITIONS. ALL MIN INST AND DAILY WATER LEVELS AND DISCHARGES NOT VALID - OCCUR DURING PERIOD OF MISSING WATER LEVELS AND ESTIMATIONS.,
02AB008,7,-999,PROGRAM STARTED 1989,PROGRAMME LANCE EN 1989
